review_content,sentiment
it is good within the price segment. but there is some delay when we increase or decrease volume it take few seconds to reflect on tv. else everything is okay,positive
it is good product...recommended for buying...specifically juicer is good....noise level is normal (with comparison to other branded products at this price) ...,positive
it is good is if you want a budget power bank but maximum it last up to 2.5 charges in apple 12 pro max the charging is super fast the disadvantage is it take so long to get recharged,positive
it is good for small family and easy to clean.pl.provide at least 2 meier cord for immediate use and mak  eplace for 360 movement cord.,neutral
it is good for single or double people sharing room,positive
it is good for data cables...i liked it,positive
it is good for data cables...i liked it,positive
it is good but please sell spare parts also like stand  lock and all the things,positive
it is good and strong enough. paint may remove after years but quality is good and price is half from the one installation guy brings.,positive
it is good and fragile,positive
it is good and easy to use,positive
it is good,neutral
it is flawless and very nice to use and hold. initially,positive
it is excellent designed by havells. free installation was done by havells on very next day of purchase. used for kitchen,positive
it is exact same volt and watt as my old charger is.,positive
it is easy-to-use. recommend for all.,positive
it is easy to use and wrinkle free and happy for using first time. thank you amazon.,positive
it is easy to use and easy to clean . also light weight and good speed that is waht much needed for frothing. it is worth buying.,positive
it is easy to install at home. the kit has all that is required to install the protector.it does not affect the touch or the front camera,positive
it is built really well & is very compact in size.it also supports fast charging my poco x3 pro (33w).though it seems to be a bit loose for my car,positive
it is broken and it is not useful. please change this product,neutral
it is big to travelling purpose other wise it is good,neutral
it is best useful mouse bcoz wireless mouse for work from my shop.i am csc shopper so it's need to me. so smooth work for laptop or pc thank and again thanks for amazon delivery services.this wireless mouse is very smoothly working. thank you so much,positive
it is battery-operated,positive
it is awsome product,positive
it is an original product. got it at a discounted price.  everybody should consider it.,positive
it is an awesome upgrade for beginner level gamers,positive
it is an awesome cable i got it from amazon. do charge my phone in a fast way.,positive
it is an awesome cable i got it from amazon. do charge my phone in a fast way.,positive
it is actually set of 2 three feet cables,positive
it is acceptable for the price ( inr 399 ),neutral
it is able to remove crease from jeans and even t-shirt.we prefer stiff shirts for office wear so no good for formals or casual shirts neither that good for pants.the water filler should have been round shape being a conical shape it does not give idea as to what level the water has been filled.based on the water container it can steam 2 to 3 clothes at a time. also,neutral
it is a wonderful product and gives the best experience and reasonable price. build quality and smoothness is excellent. it totally gives a premium in-hand feel.would definitely recommend it.,positive
it is a very good product. decent cord length. the grill marks on my sandwiches and panini come out excellent. value for money is good,neutral
it is a very good product for wfh and study,positive
it is a use and throw product.it can be used for 2-3 years.it can't be repaired properly.,positive
it is a tangle-free cable & does it's job well by decreasing the chances of the cable tangling. despite the metal construction,positive
it is a short copyyou can use it as a diary,positive
it is a satisfactory bluetooth speaker and is perfect choice for those who are looking for a budget wireless speaker for their laptop or mobile phone with low volume issues or for those who need some portable music device and who dont want to shell out lot of money. it serves these purpose very well and is not pricey. why i am saying all thisfirst things first,neutral
it is a nice product it does what as it says but the only thing is it does not have a great speed if you put a dura cell battery then only it will show the speed and second thing is the frother my friend recieved from insta cuppa is another and what i recieved is another she has a thing or a button where you don't have to keep pressing the button to froth but in my product i countinuesly have to press the button to froth,positive
it is a nice product,positive
it is a nice cable as it fits in most of the phones and devices.sturdy one,positive
it is a good product.,positive
it is a good product with easy to use functionality and easy to clean .can accomodate and boil 7 eggs at a time,positive
it is a good product valued for money but i think it should be sometimes give low speed,positive
it is a good product under rs.700/- but battery backup could be more efficient. if have a habit of playing song during travelling on bike approx 2-3 hrs and attend frequent voice calling in a day then its battery goes down in next day,neutral
it is a good product for this price.,neutral
it is a good product as it is quite useful when you vlog or want to take group photos. it will easily carry your mobile phones and small cameras but dont even think of mounting your professional camera on it,neutral
it is a good product and this month i bought 3 pieces. the last one looked like a used and refurbished heater. the wheels provided with the heater are old and worn out. they do not rotate smoothly and there is difficulty in moving the heater.,neutral
it is a good product,neutral
it is 8 inches only.for making alu parathas like that if the size was bigger than it like 9.5 inches like that then it was more easy to make  stuffed parathas,positive
it is 1500 watts kettle which is on the top of ordinary indian domestic non power 6a plug. they have given one meter quality wire  with 6a plug.  this means if your home wiring can stand 1500 watts on ordinary non power plug you can use it in any socket anywhere. (the switch in the kettle is bit wobbly,positive
it indeed cancels out the exterior noise,positive
it helped me a lot for my 2 months working from bed. they can improve on sturdiness a bit,positive
it heats up more when we perform r/w operation for a long time continuously. when we plug in mobile and then in pc i am getting some kind of error but files are intact and able to copy it,positive
it has two knobs- one for toast and one for grill. overall it's bang for buck,positive
it has been only 1 month since i have bought this item so i can't comment on its durability but currently it is working perfectly. sound quality is good. fitting in ear is perfect which has been constantly an issue with other earphones i have used till now.i have doubt on its durability because its wires are kind of handle-with-care. if it is durable then it will be among one of the best earphones,neutral
it has become worse and my phone dosent charge or takes too much time like 11 to 12 hours. sometimes it doesnt even connect to the phone.dont buy it,neutral
it has become worse and my phone dosent charge or takes too much time like 11 to 12 hours. sometimes it doesnt even connect to the phone.dont buy it,neutral
it has bad adhechesive.,neutral
it has a rope-ish wire which is very long and i needed it for the car when i am charging while travelling. decent speed for charging also. its not super fast like your regular iphone charger but it does the job well. compatible with portable charger also,positive
it has a option of extended warranty for 6 months. related to packaging i am little disappointed because i was not able to make out of its new or used product. i just made sure there are no scratches on the product. it didn't come in amazon box though.,positive
it has a good sound and audio quality. it have  not very good in noise cancellation. it will filter some minute sound .it is helpful for youtube video creators.but the clip is very hard so i can't fit it in shirt.it is worth for the cost.,neutral
it has a good grip and a good handling,positive
it has a fast heating ability and comes with auto cut out system,neutral
it had to be pried out by tweezers.now that i have peeled the outer covers of my eneloops to slightly reduce the diameters,neutral
it goes well without any issues. so don't know what to say. if you want to put 2k extra and buy the original,neutral
it glides great but is sometimes not..,positive
it gives hot water but only after 25 min of running which i feel a bit slow.  let's wait for years now to come up with it's performance.,positive
it gets unplugged from the car(ford ikon) even if the wire is moved a bit.,positive
it gave new life to my clothes. i just have a single complain and that is regarding its dust collector lid or container it is little bit loose because of this sometimes all dust and wool particles spills all around.,positive
it funcions properly and useful to me.,positive
it funcions properly and useful to me.,positive
it fits perfectly on remote. its worth for the money i spent.,positive
it fits comfortably in any switch board and a red indicator lights up inside it,positive
it don't have voice serch option,neutral
it doesn't support dual connectivity  (which is available in even boat's below 1000 headphones)dual connectivity is very much required for many,positive
it doesn't support apple car play connectivity. good quality. but when winding down the cable most of the times gets entangled.,neutral
it doesn't need any installation headaches.only reason i deducted one star is because this mouse is a little oversized for my hand. so,positive
it doesn't mean that it will fit everybody as there are many dissatisfied users around the globe.the finish,positive
it doesn't make any noise. speed okay for this price range. light weight. i don't face' any issues in this fan. over are good.,positive
it doesn't fit easily. little water pressure the filter falls off. fitting is draw back for the product. water purification method implied is good. installation must be made easy.,neutral
it doesn't feel like premium phone.2. i don't like the sound quality although is has dual speaker. you can feel vibration on its back pannel which feels very bad.3. selfie camera needs improvement.4. zoom is very bad on rear camera.5. no ip certification.6. no expendable storage.7. paid theme store.8. should have some dot notch animations like samsung.  at last i can say it is a nice phone with some cons,positive
it doesn't bend out of shape very easily,positive
it doesn't bend out of shape very easily,positive
it doesn't bend out of shape very easily,positive
it doesn't affect the output as much as other local cables.great product to buy for your pc,positive
it does the job. the capacity is huge and you can easily store 1 week's laundry. the top is detachable,positive
it does the job really well. no complaints regarding the charging power. at a price of rs. 199/-,positive
it does the job really well. no complaints regarding the charging power. at a price of rs. 199/-,positive
it does not waste the ingredients like stirring with a spoon. so,positive
it does not support fast charging. hence used fast charging cable for both charging phone & pw bank.2. leds is of no use from a few feet distance. as they r so mild to be seen from a distance. you will have to hold pb very near to actually see leds. although not a deal breaker but definitely 1 star deducted due to this.3. bulky very bulky,positive
it does not suck the air dust or small particles which are part of dust. fail to understand how will it purify the airproduct is physically working good. but not meeting the cause of purifying the air.,neutral
it does not compliment the sleek laptop i use it with.  probably a direct plug in extension (no cord) would be a much better option.,positive
it does it's job very well,positive
it does its job fine.,positive
it do cooling but not that like i was expecting.,positive
it didn't last for more than 15 days and has stopped working. absolutely waste of money. please don't go for this product,neutral
it did not prove to be as useful. the sealing side does not heat enough for a packet to be sealed well. the cutter side works fine. but mostly,neutral
it depends on the dough you prepare.with little practice we can make pluffy rotis.only thing is we cannot touch the steel part of the roti maker while preparing rotis.the steel part gets heated up.so we have to carefully deal with it without touching the steel part.other concern is,positive
it clearly removes hair from velvet material but in clothes,neutral
it changes the angle and gets loose in a few days only,neutral
it can smoothly remove instead of sudden out with little jerk.,positive
it can give you moderate warm water continually which is a plus. should give it a try if looking for cheaper and best option for kitchen use.,neutral
it can also be a little difficult to vacuum as the it sucks in the surface,neutral
it been a month since i started using this product,positive
it automatically cuts off the power supply and turns off the light .the bottom of water container can be used to make a hole in the eggs and hence eggs can be peeled off easily after boiled properly.we can also set the water level and how much to boil the eggs . according to the level of water we put in,positive
it asked me to download hp software from microsoft windows store and a few next-next-next things,neutral
it a complate surge protection device,positive
iska tauch kaam nahi kar raha hai aur kewal mobile adoptot se charge karne par on dikh raha phir turat band ho ja raha hai.ise wapas karna hai.,neutral
iska tapman vagaira sab achcha hai install karne mein lagbhag 5 minut bus lagta hai aur aapka geyser ready,positive
is it fast. highly recommend it if your hdd has slowed down,positive
is is easy to use and we can use it for everything.it is orerall great,positive
is good to use but what i observed is that its heats the water at 80  only ~not~  more than its not that hot to mix but its good if heat and ready to bath. ..  it takes around 12 min to heat good to bath in winter,positive
is better automatic but heating temparature is not good manual is good,neutral
"iron got damaged in just 1 year. while past few months i used before that just using occasionally like 1 time in month. same uses of grinder. but currently grinder working fine. this review date 30 dec""""22 purchased product at 7th oct""""21.",neutral
iphone charger last for two months only,neutral
iphone charger last for two months only,neutral
iphone & sony mp3 player. all this went for more than 10 days & finally,positive
invoice should have been given inside the cartoon for problem in future,positive
invisible (for the mutual color theme for device and product),positive
instrumental details,neutral
instructions are not really needed,positive
instructions ( manual) not clear,positive
institutions free is very expensive and difficult prasasan but thanks for amazon,positive
institutions free is very expensive and difficult prasasan but thanks for amazon,positive
instead sound like white noise. earpiece volume is low. so is the speaker volume when on call. on the other hand,positive
instant warm or hot water. connection pipes are not provided this time.due to this the total cost rises up to 3000. previously it was provided with the heater.,positive
installments very easy,positive
installation was easy.i got it for my tablet.i had a confusion bw this and sandisk and finalised this one coz mine is s6lite.free spce shown as 119 gb..it's been only two days.no problem faced.will update if any issues arise.,positive
installation was easy.i got it for my tablet.i had a confusion bw this and sandisk and finalised this one coz mine is s6lite.free spce shown as 119 gb..it's been only two days.no problem faced.will update if any issues arise.,positive
installation was easy.i got it for my tablet.i had a confusion bw this and sandisk and finalised this one coz mine is s6lite.free spce shown as 119 gb..it's been only two days.no problem faced.will update if any issues arise.,positive
installation parts are not adequate and make clicking sound in low speed (anything below full speed. if we live with that then everything is ok,positive
installation is a bit tricky but can be done .this varient is fit for a family of 2-3 people only.it takes time to pour water in the filter.... overall fine product,neutral
ink gets over after a few prints,neutral
ink color 805,neutral
ink cartridges are easy to install. genuine product with very fine print quality.,positive
initially the pendrive i got was getting very hot when inserted and without doing anything but then i applied for exchange and the second time i got a pendrive it just gets little bit warm and is much better than first time. i had called sandisk for first pendrive and they asked me ask for replacement so i did and second time i've got good pendrive. go for it.,positive
initially i got a damaged product and amazon replaced it in a day. this is what i needed to start the mornings. excellent product.,positive
initially charges very fast but after 7 months saw a diffrence in speed,positive
initially charges very fast but after 7 months saw a diffrence in speed,positive
initially charges very fast but after 7 months saw a diffrence in speed,positive
initially charges very fast but after 7 months saw a diffrence in speed,positive
initial review post 1 month usagecharging time - more than 6 hours with fast charging power cable & power adaptercharging phone - can charge a phone 3-4 times(tested with 3400mah battery)leds - utter waste. so mild that it cannot be seen from a distancethis power bank truly delivers as mentioned. i was able to charge my 1+7t phone 3 times fully with still some charging left in power bank. it took around 1.5 hours to charge my phone completely. absolutely amazing product at offered price,positive
initial impressions: works as said,positive
initial impressions: works as said,positive
initial impressions: works as said,positive
initial impressions: works as said,positive
initial impression in good,positive
infact iphone pin keep coming out even with small movement,positive
infact iphone pin keep coming out even with small movement,positive
induction is good working,positive
indispensable tool for coffee lovers  specifically for making a professional tasting latte,positive
indicator is very helpful,positive
indication switch should be there after water is filtered,positive
indicater just relocate but ok,positive
including this particular model,positive
including google maps. (location was not getting captured)2. tried to return it on the 8th day of purchase after running into issues with every app i open. (tried on 7th night as well,neutral
including design & function,positive
in this product.. ink quality is too good,positive
in this product realsing heavvy  noise pollution in 4 th spped,neutral
in this price worth to go for,positive
in this price range,neutral
in this photo you can see my old ones on left,positive
in this more irritating is the deep bass after putting speaker in deep bass the volume automatically decrease when there is a bass in the song and volume is only for the room it can't be used in bigger room's,positive
in the variant i received.can purchase this product and can give it try for me it's working doing the job.,neutral
in terms of bulid quality it's plastic and you know it beforehand,positive
in stability and in branding & look,positive
in simple words,positive
in picture shows as 16 nos but in cover only 8 nos,positive
in picture shows as 16 nos but in cover only 8 nos,positive
in night camera won't work.. u nned to on extra light for it.. only work in day time conditions,positive
in my observation. in it,positive
in my mi tv i am using only tv remote to adjust sound and aame connectivity  same soundbar,positive
in my case) to tweak up the settings to get noticed on its bass.- very mediocre performance of mids and highs too. (gets slightly better if tweaked with an eq app).- causes pain in ears if used continuosly.//if you are looking out for a decent budget usb c earphones mainly for calling,neutral
in hand texture is good. may not be good for gaming as it feels little brisk after using it directly on table not sure it will be like that itself or it's my experience.,positive
in fact looks a bit old even when brand new. the band name is also not imprinted clearly. looks cheap,positive
in ear wired headphones usually.. used sony skullcandy soundmagic kz.. m not gonna say its better then all of the above but u will be satisfied with the product.. sound quality is awesome.. bass is good not like in ear..but still wonderful and enough .. u cant have the effect of an in ear earphones bass quality in a cheap bt.. for that u need to spend at least 10k i think.. it has a passive sound isolation.. nd its great.. due to its fit and the foam half of the outer noise gets substacted just by putting it on.. then the rest go out while the music is on.. dual mode is good.. but don't think anyone would use the normal mode.. cant use the phone eq on nt headphones thats a down side.. but u can use other third party eq or the eq in spotify or saavn works.. the headphones itself might feel it could break cos all of it is made of plastic.. but feels like its a good one... and wont break .. the pads are soft it dosent hurt the head or the ear.. used it for hours.. been hearing from a lot of review about the sound quality of these.. but believe me most of them r giving the review after using it for the first time.. headphone guide 101 u need to burn the drivers i mean u need to use the headphones for a couple of days to get its full potential.. and sound quality is very good.. vocals are easyly separated bass is enough.. treble is the right amount (the way i like it) sound stage is good due to being a on ear with big dynamic driver.. and u would feel the richness of the sound cos of the brand.. a better headphone is the one which creates good and detailed sound.. not those who are loud.. so yeah i would recommend this over boat. and one last thing.. due to it being only a bt headphone and no aux cable is available.. the sound quality deepeneds on the device ur using the bluetooth quality and the amount of sound out put it can produce.. u can charge it with ur nrml charger if its 5v .. do not use fast charger.. been using it for two days now.. need to burn them drivers more.. and will update on the sound quality.. and yeah the battery back up is really good have used it for almost 4/5 hours still 70% charge left.. it shows in the bt connectivity sec on ur phone.. at the end if ur looking for a headphone with a good premium look a well reputed brand and great sound quality do buy this without a doubt.. this r satisfactory very much.. go for it.p. s amazon delivery is really not up to the mark.. even being a reputed company and all ow and another thing saw some complain about it being manufactured in china mine says manufactured in malaysia.. yes its a original one have registered it with harman audio..,positive
in comparison colour is very dull. probably due to recycled material. still very useful product. worth the price paid.,positive
in built acoustic/3d sound (nice),neutral
in amazon they mentioned 2 years of warranty + 6 months of extended warranty. but when i contacted customer care they told 1 year of standard warranty + 1 year extended warranty(motor only) on registering in thier website and only 6 months warranty on jar blades,positive
in 3 months it stops working and service center almost close in pune so i am very frusteted by this product. bad service by prestige so never go for this product.,neutral
impression of the pen were good... handling grip is also ok. can be recommended to buy,positive
immersion heaters have changed very little in terms of features or design over the 40 years or so i've been using them. and regardless of which brand name is stamped on them,positive
immediately i contact customer service,positive
image and video call quality improve afterall its hd camera gives better output than laptops original basic camera. inbuilt mic quality is nice and noise cancellation working fine.,positive
i'm writing this review.battery (the most important one): 10/10 - it came with a single aa-sized battery (clock battery) that worked from 1st april -  10th december which is more than 8 months.  even though my usage was heavy (6 hours average per day) in a corporate job day of 9 hours.look 7/10-  amazing with beautiful curves. though battery closing pane could have been better.usb transmitter: 9/10 - it's normal and can be carried inside the battery cavity.switch: 5/10 - on/off switch is not handy,positive
i'm very happy buying this product,positive
im using this product.pros:compact,neutral
i'm using this in my car from 3 months quality of product is as described andit's working very good with my redme note 5proquickly charged under 45 min 0 to 100% 5000mah batteryyou just need fast charger.,positive
i'm using this from last 3 years. im happy with the product.,positive
i'm using this from 6 months back,positive
i'm using this cable since 1 years and currently this cable is running perfectly without any problems.if you want to buy best type-c cable then without thinking buy it.,positive
i'm using this cable since 1 years and currently this cable is running perfectly without any problems.if you want to buy best type-c cable then without thinking buy it.,positive
