review_content,sentiment
zipper works smoothly and it has a perfect fit for a 14-inch laptop of mine.,positive
zero response from both side of the key and had to press hard in the center part as well,neutral
zero hassles,positive
zero hassles,positive
zero complaint. go for it!,positive
zero complaint. go for it!,positive
zebronics product is always good. i bought this product for my laptop and using everyday for watching movies,positive
zaruri nhi reputed company ka hi product acha ho,neutral
z and the windows keys). i turned over the box and dumped everything and voila! the missing keys fell out. not off to a great start but i slapped those keys on (which was very straightforward meaning that replacing keycaps in the future will be relatively easy) and plugged in the receiver to my laptop. no setup or 3rd party software necessary,positive
you've to press too hard,neutral
youtube.we can't adjust brightness of tv.,neutral
you'll need to move it so many times slowly on the whole cloth.steam amount is fine but design is such that you can't press it hardly on to the cloth during ironing.so overall do keep in mind before buying that it's only for emergency & travel purpose for de-wrinkling already ironed clothes.,neutral
you won't miss out on much just a bit of bassgreat buy though,positive
you will never turn back (using it on a weekly basis since nov 2021,positive
you will need to connect this to your monitor's vga cable (duh!). i've been using this for slightly more than a month now,positive
you will enjoy the music for sure. it's loud with decent bass. but if you are picking this up for calls,neutral
you should think twice,positive
you should care and think twice before purchasing this product.,neutral
you should absolutly goo for it,neutral
you say it's amazon product but after booking many times nobody came for installation,neutral
you require to scan the bar code on the invoice and whatsapp the details.without any delay,positive
you needn't fear about the mobile loosening and falling off.,positive
you needed to go through all the stuffsthere is a similar tv with official android 11,neutral
you need to sync with original tv remote to make volume,neutral
you need to buy mi ir cable and set it up.* or else directly connect the set up box via av or hdmi port,positive
you need some kind of support at the back - just hanging on the hanger is not enough. the manufacturer should have given a though on this and could have added an accessory either free of cost or at additional charge.well so - if i get more information i will update,neutral
you need a long nail to switch it on/off but is strong enough to resist a hard stroke when you force it to off with your nailless fingers.precision and laser: 10/10: precision is just what most mouses have which is accurate and the laser is invisible (no annoying light in the bottom).buttons: 7/10 - buttons produce a slight noise on click and after a long usage the left button is shaking slightly.overall ratings: 9/10the main reason for you to buy this: its battery efficiency,positive
you might wanna cover these with cable raceways or even paint them like i am planning to do.,positive
you ll lose your eggs,positive
you have to pay for installation,positive
you have to get used to changes in flavours as compared to fried foods. device is easy to use and clean.,positive
you get what you paid for so not going to brag about it. picture looks crisp,positive
you feel i should recharge it now otherwise i will have to survive on without bluetooth calling feature.but overall i would like to say it is a good deal in this price.,neutral
you can't have google app services and play store,neutral
you cant expect it to crease out the cotton shirts but it is a very handy product,positive
you cannot steam more garments.also,neutral
you can use it as coffee,positive
you can use if you wish to have black coffee or filter coffee. you cant make coffee using milk.,positive
you can use android & iso devices.,positive
you can use 1/4' connector if needed.@ it has very long cable which measures upto 20 feet,positive
you can simply go for it. strongly recommended.,positive
you can simply go for it. strongly recommended.,positive
you can set many macros you can revamp the keys and also change the dpi values. these features usually come in expensive gamming mouses,positive
you can remove alot of lint at a particular time without cleaning it.this lint remover has just saved my time and efforts.happy to use it . you will receive extra blade,positive
you can make an arrangement to hang the clothes on a wall hanger and remove lint by keeping your neck straight.other than that it is a good product and can be tried.thanks,positive
you can literally feel the space opening up. all the instruments feel individual and sound separated. fireflies (by owl city) sounds lovely and all the strings sway in the centre while the various zaps and buzzes surround you. it's really great for the price!  1.2 treble and mids: clean and clear. the bass doesn't overpower them and feels just right. the vocals come out clearly and all the instruments don't interfere with it (drive home by steven wilson sounds great!).  1.3 bass: punchy and tight. i love how it fizzles in 'bonfire' (by knife party) and how it reverberates in 'turn down for what' (by dj snake). 'breakin' a sweat'(by skrillex,positive
you can go for this one. also tried dual feature i.e. charging power bank & at same time charging phone and it works well no problem. did not face any problem with power bank heating issue while charging phone or itself. type c charging port for power bank is good so you don't have to carry two different cables and type a usb cables are hard to find.few cons what i felt after using1. charging cable provided along is of no use,positive
you can feel it but it's not adequate and gets muddles out if the volume raised. pls make use of your eq app (poweramp equaliser app,neutral
you can explore recordings from sd card. but you can not download.for download in mobile you have to subscribe imou protect plan,positive
you can expect a lot of misunderstanding on how everything works together in a home security camera in general.initial setup: it is a breeze for some,positive
you can easily transfer files between two android phones,positive
you can drive and charge simultaneously. type c is good and the other pin is very hard to insert but workable.,positive
you can drive and charge simultaneously. type c is good and the other pin is very hard to insert but workable.,positive
you can definitely get this product i am using it very roughly but there is no problem at all works fine,positive
you can charge your iphone easy.,positive
you can carry it with you anywhere.... there is no need to worry about space. you can makea list make a note and absolutely you can re-use it.,positive
you can buy this rs 99 + shipping charge from flipkart,positive
you can buy it,neutral
you can buy but don't go for printing,positive
you can buy a good product.,positive
you can always trust amazon basics. got it yesterday and the quality and feel is good.,positive
you can also buy it's plastic varients both are same in speeds.also plastic heat less,positive
yet to use it but looks quite classy and sturdy. design is nice and base is detachable for easy cleaning.,positive
yet this mouse still survives.even the rubberised grips are still there. go for it without any hesitation.for those having button issues,positive
yet mouse constantly shows lag and skips during movement.,positive
yet another good product from philips,positive
yes the product is very useful and serve the purpose for what it is.,neutral
yes it's very nice,positive
yes it's very nice,positive
yes it's very nice,positive
yes it's very good product,positive
yes it's a great product for me! it charges my samsung galaxy j8 which has a usb port with the new samsung 25w charger which has a type c port! but be careful as it charges at 15w. it does the job pretty well but it's made in china whereas the samsung charger is made in india,positive
yes good product,positive
yes bass is also best,positive
yes,positive
yes,positive
yes,neutral
yes,neutral
yes,positive
yes,positive
yes,positive
yeh product bhi acha or iske price bhi kam h.i like it,neutral
yeap this cable support 65w fast charging tested on my 65w brick of realme 7 pro..cable and pins quality looks good.since i couldnt find original cable for 65w charger of realme i was searching for long time for a good one...,positive
yeap this cable support 65w fast charging tested on my 65w brick of realme 7 pro..cable and pins quality looks good.since i couldnt find original cable for 65w charger of realme i was searching for long time for a good one...,positive
yeap this cable support 65w fast charging tested on my 65w brick of realme 7 pro..cable and pins quality looks good.since i couldnt find original cable for 65w charger of realme i was searching for long time for a good one...,positive
yeah here is the honest review.... looking good..quality is okay... not an defective product... but i'm not satisfied with the phone holder... it is too straight,positive
ye small h isliye portable to h but designer clothes me mushkil hoti h. simple sewing k liye achhi h agar apke pass badi machine na ho aur budget b kam ho.,neutral
ya satisfactory work. speed okay,positive
ya i love it this for easy to use and clean very useful when u want to chop a juicy tomato or leafy veggi and also size also quite good for smaller family,positive
ya an amazing fit for my alexa and very easy to place anywhere on any socket.,positive
y,neutral
wrong advertisement. only 11 fins for a 13 fin oil heater.,positive
writing this review after a month of use.works absolutely fine,positive
writing this review after 2 weeks.,neutral
writing this after using it for two months --pros -1. noiseless button2. soft press3. lightweight4. good build quality5. non-eraseable button sign6. easy battery installation7. good support range8. all button work properly9. all 104 buttons are available10. low battery indicator (the indicator does not glow when you install the new battery. it glows only when the battery is low.)cons -1. no num-lock light2. no caps-lock light3. no scroll-lock light,positive
writing review after using more than month. product really helps during winter season / when you feel cold.adjustment for heat temp based on power watts available.there is a regulator available to adjust fan speed but it won't work by design. it works as like on / off  function,positive
writing review after one month usage. very good quality and worth the money. no issue till date. go for it,positive
writing  review after 1.5 month use overall good but it become little slow when we install apps rest everything is fine. i liked it and i think you also love it if your budget is in this range.,positive
writing  review after 1.5 month use overall good but it become little slow when we install apps rest everything is fine. i liked it and i think you also love it if your budget is in this range.,positive
writes smoothly,positive
write speed is 60-70 at normal with a minimal level of 65 and peaks at 156..in mobileupdatethe disappointing thing is reed speed... i got upto 90 mbps read and it won't goes beyond 90mbps but write speed sometimes peaks at 120 mbps... i got this memory card only for the purpose of read speed not for writing speed..because i won't use this in any action camera or dslr... only for mobile which needs atleast 150 mbps for smooth performance.....i am totally disappointed for my purpose but satisfied.. according to price..so my conclusion if you are looking for a memory card for 4k/8k recording you can surely go for it..i case of u are purchasing on seeing it's read speed and also for mobile it wouldn't be a better option...,positive
wouldn't say great but okay for the price tag. overall good for work purposes.,positive
wouldn't look like a movie quality which we are used to of watching in the likes of sony,positive
wouldn't look like a movie quality which we are used to of watching in the likes of sony,positive
would repurchase,positive
would recommend to purchase a branded product than a non branded product,positive
would recommend,positive
would recommend,positive
would recommend,positive
would recommend,positive
would recommend,positive
would recommend,positive
would recommend,positive
would recommend,positive
would recommend,positive
would have liked the product to be in the company box sealed. i'm not sure why that is not possible these days. it seems to be a common trend to ship in a separate pack. why can't we have company box pack?,positive
would be my very next order if apple cable is too expensive,positive
wotks fina and removes everything easily.a must buy product for winter.,positive
worthy product at this lowest price,neutral
worthable product,neutral
worth using since 1.5 years,positive
worth using since 1.5 years,positive
worth using since 1.5 years,positive
worth using since 1.5 years,positive
worth to buy ..sound is also good,positive
worth to buy,neutral
worth to buy,positive
worth the price.,positive
worth the price,positive
worth the price,positive
worth the price,positive
worth the penny:used for 2 days,positive
worth the money..very nice product and very sturdy!,positive
worth the money as its a fun experience to use instant cam!product is original with good packaging!,positive
worth the money,neutral
worth the money,positive
worth product at this price,positive
worth product,positive
worth product,positive
worth product,neutral
worth of buying,positive
worth monitor this price,positive
worth itsame as original,positive
worth its value,neutral
worth it.,positive
worth it,positive
worth it,positive
worth it,positive
worth for the price,positive
worth for the moneysuitable for hard use,positive
worth for the money but the knob is slippery,neutral
worth for the money,positive
worth for price.. it's two layered. the outer black looks shiny and inside steel is bit delicate but over all its good product.. 2l and it's auto off feature is working perfect.,positive
worth for money.. but it's light weight so only for setop box stabilizers other over weights can't carry,neutral
worth for money. excellent performance.,positive
worth for money.,positive
worth for money product.,positive
worth for money but built quality improved required in inner thread to plastic mould place,positive
worth for money and easy to use,positive
worth for money and best for home use. screen size also good and eye protection is best,positive
worth for money - suitable for android auto... my purpose served in car....got it for rs.150,positive
worth for money - suitable for android auto... my purpose served in car....got it for rs.150,positive
worth for money - suitable for android auto... my purpose served in car....got it for rs.150,positive
worth for money - suitable for android auto... my purpose served in car....got it for rs.150,positive
worth for money,positive
worth for money,positive
worth for money,positive
worth for money,positive
worth for buying this speaker. sound quality is good and loud. weightless easy to carry. good battery backup. it's coming for more than 4hours. not tested properly but having good battery backup for sure. don't expect bass. having little bit but don't expect more. i'm writing this review after 5 days of usage.,neutral
worth every penny compared to the cost. a basic bluetooth band that support only single device at a time. call voice us clear,neutral
worth buying.,positive
worth buying this cable,positive
worth buying this cable,positive
worth buying prodect,positive
worth buying for eggetarians,positive
worth a buy,positive
worth,neutral
worst product,positive
worst cable. not working even after replacement. dont buy guys manufactured in china.,positive
works with my casio ct-x700 well,positive
works with my casio ct-x700 well,positive
works well. will comment on durability after using it for a few months.,neutral
works well. the heating concern mentioned by prior reviewers is apt however don't a damper for a purchase at this price. it's a decent product in the affordable category. the floor attachment particularly works very well. it is light weight and so cleaning lower end of ceiling fans was easy. the suction power when using sofa attachment is quite good in cleaning dust stuck in stitching corners. overall,neutral
works well. sturdy built and good quality. only worry is not made in india :(,positive
works well. just as described. looks great and easy to installhowever the tank is really small,positive
works well. good design. it's heavy.you can't work for 1 min continuously. you should stop and use. else it's heating up too much.,positive
works well.,neutral
works well with playstation 3,neutral
works well with my tatasky. re durable,neutral
works well on my 4k amazone fire tv stick as well as 2nd generation fire tv stick.if your original remote is got damaged. buy this one. but price is a bit high. should have been available for rs. 800/-,positive
works well for my basic usage.the keys travel is smooth and fine,positive
works well and bluetooth connectivity is also good.,positive
works well and bluetooth connectivity is also good.,positive
works well,positive
works well,positive
works well,positive
works well,positive
works well,positive
works very well with s20 fe 5g. thumbs up.,positive
works very well with s20 fe 5g. thumbs up.,positive
works very well with s20 fe 5g. thumbs up.,positive
works very well with airtel dth. the pairing is as same as every airtel dth remote. all the buttons works properly.,neutral
works very well and its still going great even after 3 months of use ! it supports pd and it has a solid build quality,positive
works the purpose of otg for samsung galaxy a7 tab,positive
works smooth,positive
works really well,positive
works perfectly with the airtel hd set up box (not suitable for airtel xtream). would generally be apprehensive before buying a remote online but this worked perfectly.,neutral
works perfectly on samsung s22 plus. i often use it for video editing too. but i think it's overpriced. i got it for rs. 389 including delivery charges. it should cost max upto 250. 2 stars have been cut for overpricing.,neutral
works perfectly on samsung s22 plus. i often use it for video editing too. but i think it's overpriced. i got it for rs. 389 including delivery charges. it should cost max upto 250. 2 stars have been cut for overpricing.,neutral
works perfectly on samsung s22 plus. i often use it for video editing too. but i think it's overpriced. i got it for rs. 389 including delivery charges. it should cost max upto 250. 2 stars have been cut for overpricing.,neutral
works perfectly fine.,positive
works perfect for connecting my dslr to ipad & tethering. seems like a durable cable.,positive
works great no problem so far.the build could have been slightly better,positive
works great,positive
works good. wire is also not very  short,positive
works good for me in himachal. consumes electricity but u getsilenceno dry eyescomfortable environmentbuy it if u value ur comfort n silence.otherwise take any other blower which will dry ur eyes n throat and create a sound,positive
works good,positive
works for charging but other applications are hit or miss.example my external keyboard doesn't work with it!,positive
works for charging but other applications are hit or miss.example my external keyboard doesn't work with it!,positive
works fine...will update if the dash charging stops working too quick.,positive
works fine. no issues.,positive
works fine. no issues so far.,positive
works fine with my sony bravia tv.,neutral
works fine issue with delivery product bit damaged,neutral
works fine even after 4 months as of now going good,positive
works fine,positive
works fine,positive
works fine,positive
works excellent with sony bravia tv,positive
works as said. browns bread evenly. pop up works fine. the cord is too short. have to keep the toaster on an inverted vessel to reach the plug point,positive
works as intended and mostly as description.but here are things that couldimproved.the upper lid should be able to open up a bit more to the back if we want to wash it more thoroughly since having lid not open in a way that it goes  a bit back enough for the lid to not feel a bit in the way its not as comfortable as it could be (this shouldnt become a point which should make ppl avoid buying it though since many other models seem to open up till the same angle as this one does unless you found one that opens up more than this one,positive
works as intended,neutral
works as expected. length of the cable is short and it was mentioned also satisfied my requirement. if you need more length better look other options.,positive
works as expected. length of the cable is short and it was mentioned also satisfied my requirement. if you need more length better look other options.,positive
works as expected. length of the cable is short and it was mentioned also satisfied my requirement. if you need more length better look other options.,positive
works as expected. length of the cable is short and it was mentioned also satisfied my requirement. if you need more length better look other options.,positive
works as expected.,neutral
works as described,neutral
works,neutral
works,positive
working.,neutral
working without any issues from purchased,positive
working with any types of usb either c-type or micro.temperature always normal with 2.4amp ranges .,neutral
working with any types of usb either c-type or micro.temperature always normal with 2.4amp ranges .,neutral
working well.. worth buying..,positive
working well with iphone11.,positive
working well now.,positive
working well for my camera external flash. i took almost 50 photo with various flash power,positive
working well for about 1 year. everything okay,positive
working well for about 1 year. everything okay,positive
working well and fast charing as claimed. pice is at highside. good item.,positive
working well and fast charing as claimed. pice is at highside. good item.,positive
working well,neutral
working well,neutral
working well,neutral
working well,neutral
working well,neutral
working very well without giving any problem,positive
working very nice.,positive
working very nice ok,neutral
working so good & also speed is very fast... satisfying product!,positive
working perfect great... product,positive
working great so far!value for money!4 stars as wire is very short in length!,positive
working good. water is boiling within 2 min. steel finishing is normal and not shining.,neutral
working good till now,positive
working good so far,positive
working good but need to do some improvement,positive
working good and small design as i wanted.,positive
working good also not so expensive,positive
working good also not so expensive,positive
working good,neutral
working good,neutral
working good,positive
working good,neutral
working good,neutral
working fine with airtel dth but the quality is cheap,neutral
working fine till date,neutral
working fine so far,neutral
working fine but the seller should pack it more carefully as i received the upper detachable part in a broken condition as it is  non replaceable makes it more difficult for the customer,positive
working fine as expected,neutral
working fine,positive
working fine,neutral
working fine,neutral
working fine,positive
working fine,positive
working fine,positive
working fine,neutral
working fine,positive
working fine,positive
working fine,positive
working fine,positive
working fine,positive
working fine,neutral
working easy and using also easy.favourable and believable product and company,neutral
working as it should be. no issues with reception and latency.,positive
working as intended. have used it to gring chicken and vegetables. so far working well. gripping it while it's on is a little dicey otherwise good product,positive
working as expected.,neutral
working as expected,positive
working as described but too early to comment .,positive
working,neutral
worked well for six months thats it,positive
worked well for six months thats it,positive
worked well for six months thats it,positive
worked so well..you can go for it,positive
worked seamlessly with our sujata mixex (powermatic,positive
worked on iphone 7 and didnt work on iphone xr,positive
worked on iphone 7 and didnt work on iphone xr,positive
worked on iphone 7 and didnt work on iphone xr,positive
worked on iphone 7 and didnt work on iphone xr,positive
worked on iphone 7 and didnt work on iphone xr,positive
worked on iphone 7 and didnt work on iphone xr,positive
worked on iphone 7 and didnt work on iphone xr,positive
worked on iphone 7 and didnt work on iphone xr,positive
worked on iphone 7 and didnt work on iphone xr,positive
worked on iphone 7 and didnt work on iphone xr,positive
worked fine...,positive
worked fine,neutral
worked fine,neutral
work perfectly and amazingly.must buy for cloth lint,positive
work nahi kar raha sahi karwane ke liye call nomber dijiye,positive
woollens and any fabric which is otherwise non iron-able. of course,positive
wont cure cancer its simple cable nothing much to expect,neutral
wonderful scale,positive
wonderful product...easy to use....go for it,neutral
wonderful product to use. but have some negative . reviews about durability.easy handling. easy charging. but getting repaired frequently . its only one year after purchasing but the suction power was lessened twice by the time.,positive
wonderful design and also its accurate. i would highly recommend this product for your kitchen.,positive
wonderful and compact speakers for desktop setup. it completed my gaming setup as my monitor dont have in built speaker was in search of good speakers. these are good in terms of gaming,positive
without this limitation it could be really amazing product to buy.,positive
