review_content,sentiment
sometimes some lint remains below blades and not completely expelled,positive
sometimes not working properly,positive
sometimes multiple times in a day for past month during lockdown period. i hope this will help others.mixer includes +capacity -1 mixer body1 plastic blender jar 1500ml + fruit filter,positive
sometimes its simple solutions that come to rescue than a costly alternate from branded companies.  i had my sony tv in perfect working condition but remote got worn out (kids handled it smoothly lol).  when i tried to purchase original remote from sony,positive
sometimes gets heated when used for longer,positive
sometimes burns. but toaster looks good and easy to use.,positive
sometimes 2 gives the best roast and sometimes it doesn't roast the whole bread. so,positive
something sounds louder than my laptop. i bought this with very very low expectations. but!!,neutral
some usb ports are little loose but i will manage.,positive
some times it lags and once it got auto restarted.but company has lied to customers with that there is 16 gb of space in the tv which is not therestill i like the picture and sound quality,positive
some times it lags and once it got auto restarted.but company has lied to customers with that there is 16 gb of space in the tv which is not therestill i like the picture and sound quality,positive
some times blutooth connection problem occurs,neutral
some r&d is needed for suitable recipes. but the results are amazing. almost zero oil and almost same taste. quite an healthy option for all health-conscious people,positive
some of cell is not at 100% but they are at 90 or 80%price is low but stock is old. rest ok.,positive
some issues have come up. once it gets to the boiling point,neutral
some buttons not working in first week of purchase. quality not upto the mark.,neutral
solid material. think it will last long.,positive
solid material. think it will last long.,positive
software is not updated you should give updated versions.,neutral
sofa nd sweatshirt also. these things have tried nd hope it will work on other clothes also very easily.,positive
so you may take the risk of keeping it on with one rod on for hours together with out the risk of over heating of cable,neutral
so you can arrange installation workers,positive
so while that is good for certain things,neutral
so when my wife's samsung charger cable gave up the ghost in less than 6  months,positive
so when my wife's samsung charger cable gave up the ghost in less than 6  months,positive
so when my wife's samsung charger cable gave up the ghost in less than 6  months,positive
so we have to carefully lift the product. the cost cutting is done in plastic build.over all the product is fine.,positive
so turn off or turn on the light,positive
so thought of giving a try and it is totally worth it. was suprised u get 4 of them with 90 sheet each . i use it not only for lint but to also remove tony dust particles from my desktop and mousepad. must tey if u haven't used lint roller before.,positive
so there is movement on the usb connector point when inserting or removing device from the other end of the cable.2) the usb connector is a little loose,neutral
so the space bar was just horrible,neutral
so the fit is perfect.since this is an adapter only,positive
so the fan cannot be made steady. i am afraid that the inside fitting for this knob is broken or misfitted hence the problem.please rectify the problem immediately,neutral
so that they are easily accessible to any storage water-heaters that may be installed. havells should have made allowances for this and added at least another foot-and-a-half to the cord length. for a large-scale manufacturer,positive
so that it will be easy to use. the water is getting heated in a short span of time. there is a minimum and maximum marking on the heater and the heater should be immersed inside the water till the minimum markings compulsaryly.. so if u are going to heat a half bucket of water it won't be used.,positive
so should last long.,positive
so review is basis that.looks wise very sleek product and looks sturdy. has a rubberised platform so that it doesnt move much when in motion.works as expectedthis is more convenient in comparison to the handheld chopper which breaks easily. borosil chopper has 2 year warranty as well so thats a plus.will update as i use it more,positive
so reducing one star. will contact them for replacement and update here.update 2: called service center,neutral
so raised a request for it. but.. i have to courier it to them cost rs 100,neutral
so preferably not for those who use smaller earphones.,neutral
so plz concentrate on this also,neutral
so now using this as it is. bandwidth control is a must for this price range. model was archer c80.,positive
so note that.@ it has absolutely no noise isolation and normal smartphone earphones does better job of noise reduction compared to them in stock condition,positive
so nice...,positive
so nice colour cheap and best,positive
so nice colour cheap and best,positive
so need not worry about little rain as well.  the smaller pocket can easily hold wallet / mouse or any small goodies. overall,positive
so my review is basically the first impression.i will write a detailed review after few days of use. i like the style and it looks good. so far touch operation is also good,positive
so my review is basically the first impression.i will write a detailed review after few days of use. i like the style and it looks good. so far touch operation is also good,positive
so my review is basically the first impression.i will write a detailed review after few days of use. i like the style and it looks good. so far touch operation is also good,positive
so much so that i bought another one. it's been 1 month and just had to wash the first filter once and works very nicely....everyone in the house is breathing nicely and clearly,positive
so keys are not easy accessible. though it's not the fault of the cover,positive
so it's not good for ambitious individuals.,positive
so its a long tern review). coming from another vacuum cleaner that had bags,positive
so it won't turn yellow but gets scratches easily.overall recommended.,positive
so it keeps switching on when taking a bath. especially if u have a shower the pressure gets lower trying to heat it all up,positive
so it is almost always connected to my pc while gaming.so,positive
so it had to be downloaded from amazon.to register your warranty,positive
so it feels like a wide(not actually wide but feels like) phone also it is tall,positive
so it does not provide a good ergonomic.as they say clicks are noiseless,positive
so if you have 3-pin socket points consecutively then ysing the next socket could be difficult.the wi-fi signal strength is good as extender but it reduces internet speed. for example my internet speed is 30 mbps which i get if directly connected to my primary router / network. but if connected through extender it downgrades to 18-19 mbps. overall okay to use. i would have been happy to see a made in india device as the price is also not very low,positive
so if you do drop you remote from a decent height,positive
so if you are like me who cares about the looks,positive
so if its not preffered u can go for earphones or earbuds. as i bought multiple ober the ear headphones there will be rought cloth like texture that will irritate your ears,neutral
so i will say good product in this price... not long lasting... if you want a reliable,neutral
so i used south indian filter coffee for the past few weeks and could instantly feel the difference between a cup of freshly pressed coffee and one of instant coffee,positive
so i returned d product.if u really want humidifier for medical purpose then go for genuine ( higher price/ quality) product.,neutral
so i replace that product 2nd time product box not good but product good after check there are no problem face now i am use 4month  this head phone this is good gaming pubg,positive
so i had a faulty cable. i was lazy and have a lot of money so instead of calling apple i bought this for like 300 bucks. didnt expected much but for my surprise,positive
so i had a faulty cable. i was lazy and have a lot of money so instead of calling apple i bought this for like 300 bucks. didnt expected much but for my surprise,positive
so i had a faulty cable. i was lazy and have a lot of money so instead of calling apple i bought this for like 300 bucks. didnt expected much but for my surprise,positive
so i got this keybaord a few days ago and it came in a package that can be best described as being mauled by a bear. it was totally beaten up and inside the batteries of the keyboard ha come loose alsothough i could just pop it back in no problem. thankfully it works fine,positive
so i got it today,neutral
so i can't speak for its durability. also the price has been dropping steadily on this product.  wondering why.only time will tell,positive
so i am using this as well as bought 2 spare batteries (costed me 500 rupees for 2 batteries). although i must say that you can find the cr1632 - 3v battery (the one used in this one) - much cheaper than what i paid on either local ecom website or local shops.,neutral
so havent used it much,positive
so great! it has made my favorites even more practical and delicious. i have not found anything about this product that i do not like. i would recommend this product to others and have already done so. get it! you will be pleased. it is the best coffee beater.,positive
so google assistant do not work.,neutral
so giving only 4 stars .maybe most of the 5 star reviews are only for extended warranty .amazon should act on this kind of seller .,positive
so first,neutral
so far there is no problem,positive
so far so good. it gets a bit overheated i hope the base does not melt or get over heated. have only used it once when the performance was extremely satisfying. will have to wait and see,neutral
so far so good,neutral
so far so good,positive
so far ok. will hold the wire connecting after the usb joints. but couldn't stop it from bending,positive
so far ok. will hold the wire connecting after the usb joints. but couldn't stop it from bending,positive
so far it works well. suction power is above average. blower feature is a nice addition. only con is it's a bit loud.,neutral
so far good for chopping vegetables. i am vegetarian so no comments on mincing meat. good for my family.,positive
so didn't think twice and got this. don't regret it one bit!! pros are the 3 interchangeable plates for different ourposes. grill one is just fantastic to hear all kinds of sandwiches and rolls and other food. all the plates are easily removable and washable too. only con that i saw to this was the latch wasn't properly latching while making a heavily loaded sandwich in the sandwich maker. otherwise it's a top of the range product in comparison with other big brands!,positive
so check thoroughly before use.the product us useful beyond  a doubt,positive
so cant complain it). overall the product is far far better,positive
so cannot comment on that.,positive
so called engineers.one day i was checking google and found this set-up box with 1000rs and shocked and felt it was some joke.then after approaching amazon i got to realise it is true.and i ordered one box for my 55inch lg uhd tv as they expected so called engineers  never came on time.and i had a call with customer support to get it cancelled. then they responded and came to deliver and installing.these engineers are really talented and started adding prices for every thing that i have already paid. ex. remote,positive
so buy this product blindly. writing it after 4 month of daily usage,positive
so basically its good product with good quality,positive
so basically its good product with good quality,positive
so an early review. but the most detailed review so please read till the end. very important points are mentioned.looks are cute! it looks really nice and elegant. i am using it with a macbook air. so far it seems there are no problems using it. the scrolling is smooth,positive
so all customers you go to electric ro uv water purifier,neutral
so after 8 months of use,positive
so about the product boom ultima,neutral
so,neutral
smoothies or paste in this with different jars,positive
smoothies and dry grinding.consumes less space.,neutral
smooth chalta hain aur speed changing button se mast se speed change hoti hain. only thing i am worried is that the cord will damage with wear and tear.,positive
smells bad when you open it,positive
smart watch is good with proper large displayvoice assistance siri for iphone userscalling facilityface time facilityone deficiency that you are unable to message or type text in whatsappif you have small wrist dont go for it or else its a perfect choice for your loved ones.,positive
smart watch is good with proper large displayvoice assistance siri for iphone userscalling facilityface time facilityone deficiency that you are unable to message or type text in whatsappif you have small wrist dont go for it or else its a perfect choice for your loved ones.,positive
smart tv,positive
small yet very good accessory for the car. it is very small in size and becomes a part of the car interior.there is no lag in supplying the power and gives an ease to connect phone with usb c type on a usb a port.if you are looking for a good converter then this is it.,positive
small in size,neutral
small cable otherwise good,positive
small but over all good,positive
small and handy!,positive
small and cute speakers with good sound quality.,positive
small and compact. literally the size of your hand.heated up two cups of water to 75c (hot coffee temperature) in a few minutes.great for the avid backpacker,neutral
small,positive
slow charging,neutral
slightly on the smaller side but portable.,positive
slightly imbalance legs,neutral
sleek etc yes,positive
sleek etc yes,positive
sleek body and the colour and only product of three rods with two year warranty light weight too and beautiful stand and can be rotated,neutral
sleek,positive
sketch pens and also inkpens. all cases no soaking of ink.2. binding - spiral binding and qality is good and attractive.3. sturdiness - here it could have been a little better,positive
size want to big and need more brightness over product is awesome,positive
size of speaker is conveniently small,neutral
size is very small...,neutral
single band is an ancient technology.this device will supply only 2.4 ghzthat means 5ghz will not be available in your room where you choose to use this.,positive
since while using the blower the same gets sucked in the steel tub. further if the company can provide a video on how to effectively use the product it would be great and also how to avoid pressure on the motor since the hose pipe bends while using the product.,positive
since then i had to buy this fan. packaging was absolutely amazing with thick card board box,positive
since it's metal,positive
since i have tried bajaj 13 fins oil heater,positive
since i have just started using,neutral
simply go for it.i have been using this almost for the last 1.5 years. i have been using this every day,positive
simply go for it.i have been using this almost for the last 1.5 years. i have been using this every day,positive
simply affixed on screen. there was a little difficulty faces as guide frame supplied is not 100% according to glass but some how i fixed it successfully. and thanks to seller for supply a pair of screen guard. packaging was also good.,positive
simple stitching for self purpose.,neutral
simple remote to replace original sony bravia tv remote. does the job brilliantly. lives up to product promise,neutral
simple controls and easy to use. at a time 3 to 4  six inch baking tin can be kept. rotisserie work well with 1.5 to 2kg chicken easily. since there is no crumb tray provided,positive
simple but very good,positive
simple and quick solution for some night time study session. bought it for 34 rupees cuz i didn't wanna pay the 80 rs. shipping on my order of 466.,neutral
simple and handy for travel purposes and use at office.,positive
simple and good,positive
simple and good,positive
simple and good,positive
simple and good,positive
silk materials,positive
silicon quality is awesom,positive
silicon detachable base for better cleaning and also stainless steel serrated blades for better grinding.the 600w powerful motor helps in the grinding of hard spices in no time. and the best part is it is super easy to clean.i am absolutely happy with this product and customer care support.,positive
shown 2 pieces,positive
should have give touch to awake.can have provide some more option like finding phone and finding smart watch ...,positive
should go for this,neutral
short wired atleast give 2 meter wire,neutral
short review:this eliminates a need to wrap long cables around the handlebar when the phone is mounted on it for navigation. compact and powerful. best suited for motorcycle mobile mounts and powerbanks.[price bought at: 309]_______________________________________________________________________________________long review:i used to wrap long charging cables around the handle bar so that it won't come in the way while turning. after being fed up of wrapping cables to handlebars,positive
short review:this eliminates a need to wrap long cables around the handlebar when the phone is mounted on it for navigation. compact and powerful. best suited for motorcycle mobile mounts and powerbanks.[price bought at: 309]_______________________________________________________________________________________long review:i used to wrap long charging cables around the handle bar so that it won't come in the way while turning. after being fed up of wrapping cables to handlebars,positive
short review - really good product and sound quality is very nice. good for living rooms about 12x12 ft or even bigger space. i installed it and connected to tv using coaxial cable. volume,positive
shoke proof,positive
shipment received in time on 25 th sept. due to lack of time i could test the product recently. it is working fine. wi fi set up could not perform successfully,neutral
shaving or watering plants. the drained water is same as tank water just with higher tds). the water taste varies according to the level of tds you choose very low tds will give a good taste to water but at a loss of the mineral content of water which i will not recommend. the default tds after purification is set somewhere between 80-100 (drinking water should have tds below 300)manufacturer reviewrating 2/51)the manufacturer of this product is eureka forbes i am giving a rate of 2/5 because the product that is now installed at my home is a replaced product because the first product that i received was a defective one. the drain pipe would not stop draining water even when the tank was full,positive
shape are getting change day by day..i think it will be lasting for 1 yr.,positive
sewing machine is really good . easy to use and good for beginners.,neutral
setup was quick. you just sign-in with your email address registered to hp.it's a 5/5 product but will give 4 because i feel it's a bit overpriced and paper might also get jammed sometimes.,neutral
settop box,positive
set top box,positive
set top box,positive
set top box,positive
set top box,positive
set top box,positive
service provider refuse install my tv,positive
service provider refuse install my tv,positive
service provider refuse install my tv,positive
service is very good,positive
serves the purpose but one should be careful around the stand. base is not wide enough for good balance. small push or touch will result in a fall. we have to be very careful while cleaning around,positive
serves the purpose . nice quality. if you are a baker you should have measuring spoons.,positive
serves the purpose,positive
served the purpose and delivered as marketed,positive
serve the purpose,positive
series...music experience- 4.5/5 (tbh i like to hear balanced music like crystal clear sound with a balanced bass but yeah if you are bass lover then just think again before buying it)battery - 5/5hypersync - 5/5bluetooth - 3.5/5 (i checked the box and there it's written bluetooth 5.3 but its range is low and that's not up to my expectations... but it will work for me...) so yeah if you are just buying it for bluetooth 5.3... just think again...instacharge- 5/5 it actually works very well...buds- 4.5/5 ( in ear design is good and they fits perfectly also you can do workout,neutral
serial number and matched with the box so it is genuine.,positive
sent a packet with the seal already opened.and the cartridge found to be duplicate/faulty/used one.,positive
sensor is good,neutral
seller should check the item before shipping it will reduce the negetive feedback and also return shipping extra charge will b reduced to them.no one is going to take defective product.,positive
"seller i would like to bring to notice that the while operating """" there is very irritating noise that is not very good while working.not up to the mark havells with such brand figure has failed miserably to justify the same  . heating capacity is good for delhi chilling cold but the sound or noise is very irritating",neutral
self install a bit difficult. the plate connecting to monitor could have been removable and drop in clamp . this would make fixing a breeze,positive
selecting 1 rod always switches on the top rod.,neutral
seems to fast charge at 2a,positive
seems to fast charge at 2a,positive
seems to be reasonable hot and heavy in weight as looking for.,neutral
seems ok. have not tried it with hd quality videos. value for money.,positive
seems majority of good review/ratings are paid ones. these are cheating us,positive
seems good,neutral
seems durable but there is a problem with the design that the pin is not long enough / base of the pin is too thick that i couldn't insert it into my phone's charging port without removing the case!,positive
seems durable but there is a problem with the design that the pin is not long enough / base of the pin is too thick that i couldn't insert it into my phone's charging port without removing the case!,positive
see if you own an iphone then popio is the best out there.i got this tempered glass because my last one broke during a fall from the stairs. & my last one was from popio too. so i odered another & the prices are a steal (like seriously i wonder how do they manage it for so cheap)buy it without a doubt its a genuine product.ps i like little note they left with the product.,positive
second quality,positive
search for youtube videos and they will help you a lot.there are reviews specifying the remote did not connect,neutral
scrolls and scroll clicks. i didn't find any glitches so far. works perfectly for me.about looks,positive
scroller movement is not good,positive
scroll wheel is very small otherwise the product seems good at least at the first use,positive
screen quality is good.it's been a month i bought it still working fine.two main negatives are1 it doesn't have default option to directly start on tata sky tv,positive
screen quality is good.it's been a month i bought it still working fine.two main negatives are1 it doesn't have default option to directly start on tata sky tv,positive
saves your palm from the rough surfaces. it's ok so far. the external material deteriorated a little,positive
save it purpose well without any issue. i am satisfied,neutral
save it purpose well without any issue. i am satisfied,neutral
satisfied with the product till now,positive
satisfied with the product till now,positive
satisfied with my purchase.,positive
satisfied,neutral
satisfactory performance,positive
satisfactory,neutral
saree pheeko is task,positive
sandwich,positive
sandisk is always excellent! though this review is about sandisk extreme which functions excellently,positive
sandisk 1tb extreme pro portable ssd 2000mb/s r/winitially set up the disk with inbuilt san disk software. the speed was pathetic and after some debugging found culprit in exfat default format. reformatted to apfs (encrypted) for similar secure features without comprising features. surprised to see drastic jump in performance .exfat - 48gb write failed after 30 mins.apfs encrypted - 48gb - less than 4 mins.pros -portablesecuresturdyspeedlarge volumecons-default software and filesystem.,positive
samsung should provide charger with their box,positive
samsung offers super fast charging at 25 watt....just a joke.... wherever other brands are offering full charge before an hour providing heavy chargers,positive
samsung is not....secondly samsung is offering c to c charging...you need to carry your charger always...you can not charge your phone with some other c type cable...thirdly,positive
same watt,positive
same type is available in half prize other make on amazon,positive
same type is available in half prize other make on amazon,positive
same should have been mentioned. when we pay for hi quality products,positive
same should have been mentioned. when we pay for hi quality products,positive
same should have been mentioned. when we pay for hi quality products,positive
same piece was available at the shop for rs 500,positive
same day installation provide by v guard thru v-guard whatsapp contact because before the delivery i booked for installation... installtion price 350+ 250 for steel inlet outlet pipe because this model didn't provide inlet outlet... overall my experiece is amazing with this gyser it take 30-45 min for full heat my dial is set for 45 degree+but u can use the hot water after 10 min. of heating... look wise cool and simple... i recomended to all of you go for this product 100%,positive
sahi paise ke hisab se sahi kam karta hai,neutral
sachme achcha hai,positive
